user_id,post_id,content
1001,001,"Looking for advice on wheat cultivation."
1002,002,"Just harvested my corn. How did you do?"
1003,003,"What are the best practices for rice farming?"
1004,004,"Anyone else struggling with soil health?"
1005,005,"Share your experiences with automated irrigation systems."
1006,006,"How do you manage pest control effectively?"
1007,007,"Looking for recommendations on fertilizers."
1008,008,"What are the latest trends in crop prices?"
1001,009,"Best ways to improve crop yield?"
1002,010,"Have you tried the new drone technology for monitoring?"
1003,011,"Any tips for increasing soybean yield?"
1004,012,"Share your experiences with different irrigation methods."
1005,013,"What are the common issues with soil pH?"
1006,014,"How do you deal with extreme weather conditions?"
1007,015,"Best practices for sustainable farming?"
1008,016,"Looking for advice on market trends for crops."
1001,017,"How do you handle large-scale crop harvesting?"
1002,018,"What are the benefits of precision agriculture?"
1003,019,"How to integrate new tech into traditional farming?"
1004,020,"Tips for improving water usage efficiency?"
1005,021,"Best tools for monitoring crop health?"
1006,022,"How to manage carbon emissions on the farm?"
1007,023,"What are the most effective pest control methods?"
1008,024,"Experiences with different soil nutrient management techniques."
1001,025,"Any advice for improving crop quality?"
1002,026,"What are the best practices for crop rotation?"
1003,027,"How to leverage data for better farming decisions?"
1004,028,"What technologies have you found most helpful?"
1005,029,"Tips for reducing water wastage in farming?"
1006,030,"Best ways to use satellite data in agriculture?"
